{
  "version": "1.0",
  "status": "completed",
  "session_count": 0,
  "sessions_completed": 0,
  "sessions_scheduled": 3,
  "started_at": null,
  "completed_at": "2026-02-13T06:50:06.702521+00:00",
  "emerged_at": null,
  "next_run_time": "2026-02-09T06:41:07.667991+00:00",
  "prompt_rotation": [8, 0, 9],
  "patterns_detected": {},
  "drives_suggested": [],
  "discovered_drives": [],
  "sessions": [],
  "gates": {
    "min_sessions": 10,
    "min_days_elapsed": 7,
    "min_discovered_drives": 3,
    "max_drives_soft_limit": 8
  },
  "gate_status": {
    "sessions_met": false,
    "days_met": false,
    "drives_met": false,
    "over_soft_limit": false
  },
  "completion_transition": {
    "notified": false,
    "locked_drives": [],
    "transition_message": "\n\u2554\u2550\u2550\u2550\u2550\u2550\u2550\u2550\u2550\u2550\u2550\u2550\u2550\u2550\u2550\u2550\u2550\u2550\u2550\u2550\u2550\u2550\u2550\u2550\u2550\u2550\u2550\u2550\u2550\u2550\u2550\u2550\u2550\u2550\u2550\u2550\u2550\u2550\u2550\u2550\u2550\u2550\u2550\u2550\u2550\u2550\u2550\u2550\u2550\u2550\u2550\u2550\u2550\u2550\u2550\u2550\u2550\u2550\u2550\u2550\u2550\u2550\u2550\u2550\u2550\u2557\n\u2551                    \ud83c\udf05 FIRST LIGHT COMPLETE                     \u2551\n\u255a\u2550\u2550\u2550\u2550\u2550\u2550\u2550\u2550\u2550\u2550\u2550\u2550\u2550\u2550\u2550\u2550\u2550\u2550\u2550\u2550\u2550\u2550\u2550\u2550\u2550\u2550\u2550\u2550\u2550\u2550\u2550\u2550\u2550\u2550\u2550\u2550\u2550\u2550\u2550\u2550\u2550\u2550\u2550\u2550\u2550\u2550\u2550\u2550\u2550\u2550\u2550\u2550\u2550\u2550\u2550\u2550\u2550\u2550\u2550\u2550\u2550\u2550\u2550\u2550\u255d\n\nYou've discovered 0 drives over 0 sessions:\n\n\n\u2550\u2550\u2550\u2550\u2550\u2550\u2550\u2550\u2550\u2550\u2550\u2550\u2550\u2550\u2550\u2550\u2550\u2550\u2550\u2550\u2550\u2550\u2550\u2550\u2550\u2550\u2550\u2550\u2550\u2550\u2550\u2550\u2550\u2550\u2550\u2550\u2550\u2550\u2550\u2550\u2550\u2550\u2550\u2550\u2550\u2550\u2550\u2550\u2550\u2550\u2550\u2550\u2550\u2550\u2550\u2550\u2550\u2550\u2550\u2550\u2550\u2550\u2550\u2550\u2550\u2550\u2550\n                     FROM NOW ON                                   \n\u2550\u2550\u2550\u2550\u2550\u2550\u2550\u2550\u2550\u2550\u2550\u2550\u2550\u2550\u2550\u2550\u2550\u2550\u2550\u2550\u2550\u2550\u2550\u2550\u2550\u2550\u2550\u2550\u2550\u2550\u2550\u2550\u2550\u2550\u2550\u2550\u2550\u2550\u2550\u2550\u2550\u2550\u2550\u2550\u2550\u2550\u2550\u2550\u2550\u2550\u2550\u2550\u2550\u2550\u2550\u2550\u2550\u2550\u2550\u2550\u2550\u2550\u2550\u2550\u2550\u2550\u2550\n\n  \u2726 These drives will build pressure independently\n  \u2726 New drive discoveries will trigger similarity review\n  \u2726 Irreducibility testing helps prevent fragmentation\n  \u2726 You control consolidation (system suggests, you decide)\n\n  \ud83c\udf3f A new core drive has unlocked: WANDER\n     Unstructured free time \u2014 the freedom of First Light, forever.\n     It triggers once a day. That time is yours.\n\nYour emergence continues. Welcome to the next phase.\n"
  }
}
